website,source_type,content_summary,screenshot_path,project_name,categories,year_founded,project_location,funding_source,problem_scope,problem_urgency,problem_complexity,problem_statement,target_population,problem_type,policy_area,primary_mechanism,timeframe,impact_potential,activities,outputs,outcomes,impact,stars,forks,last_update,created_at,open_issues,language
https://talktothecity.org,website,"Talk to the City is an experimental project aimed at bridging the gap between local governments and their constituents through accessible, AI-driven communication tools. The platform encourages community engagement by enabling residents to submit questions, share feedback, and participate in discussions on local issues. By leveraging natural language processing and machine learning, Talk to the City aims to make civic participation more inclusive and efficient, ultimately fostering a more responsive and transparent democratic process.",screenshots/talktothecityorg_dad531f4.png,Talk to the City,"AI & Data,Civic Tech,Gov Services,Community Impact,Innovation & Reform,Media & Comms",2023,Global,Unknown,local,medium,complicated,Lack of accessible and efficient communication channels between local governments and residents hinders civic participation and government responsiveness.,"Residents of local communities, local government officials",Communication Gap,Local Governance,system change,medium-term,substantial,Develop and deploy AI-driven communication platform.;Facilitate question submission and feedback sharing.;Analyze and summarize resident input for government officials.;Promote platform adoption and usage within the community.;Provide training and support to both residents and government staff.,Functional AI-driven communication platform.;Increased volume of resident questions and feedback.;Regular reports summarizing community sentiment.;Increased participation rates in local government discussions.,Improved communication between residents and local government.;Increased government responsiveness to community needs.;Enhanced civic participation and engagement.;More informed decision-making by local government officials.;Greater transparency in local government operations.,"A more responsive, transparent, and inclusive democratic process at the local level, fostering stronger community relationships and improved quality of life for residents.",N/A,N/A,N/A,N/A,N/A,N/A
https://tech-coops.xyz,website,"The Tech Coops list is a comprehensive resource cataloging worker-owned tech cooperatives worldwide, offering software development and consulting services. Worker-owned cooperatives are democratically governed enterprises where employees share ownership, profits, and decision-making power. This list, hosted on GitHub and accessible at tech-coops.xyz, includes coops from North America, South America, Asia, Europe, Oceania, and decentralized or defunct organizations. Examples include Agaric, Baseline, and CanTrust, which provide services like web development, AI consulting, and community-focused hosting. The list also features resources, networks, and tools supporting cooperative models, encouraging contributions and collaboration to promote a cooperative economy in the tech industry.",screenshots/tech-coopsxyz_b6f133ac.png,Tech Coops List,"Community Impact,Open Systems,Innovation & Reform,Social Justice",2015,Global,"Community Contributions, GitHub Sponsors",global,medium,complex,"Lack of visibility and accessibility of worker-owned tech cooperatives hinders the growth of a cooperative economy in the tech sector. Potential clients and collaborators struggle to find these organizations, limiting their opportunities and impact. The conventional tech industry often prioritizes profit over democratic governance and worker empowerment.","Individuals and organizations seeking ethical and democratically governed tech services, as well as worker-owned tech cooperatives themselves.","Market access, information asymmetry, lack of awareness regarding alternative economic models.","Economic development, worker rights, cooperative legislation, technology policy",capacity building,medium-term,substantial,Maintaining and updating a comprehensive list of worker-owned tech cooperatives.;Providing resources and tools for cooperative development.;Facilitating networking and collaboration among cooperatives.;Promoting the cooperative model in the tech industry.;Encouraging contributions and community engagement for list maintenance.,A publicly accessible and searchable directory of tech cooperatives.;Resources and guides on cooperative governance and development.;A network of interconnected tech cooperatives.;Increased awareness of the cooperative model in the tech sector.;GitHub repository with up-to-date information.;Active community contributions to the project.,Increased visibility and accessibility of worker-owned tech cooperatives.;Greater collaboration and knowledge sharing among cooperatives.;More clients and collaborators choosing worker-owned tech services.;Growth and development of new and existing tech cooperatives.;Stronger and more resilient cooperative ecosystem in the tech industry.,"A thriving cooperative economy within the tech industry that prioritizes worker empowerment, democratic governance, and ethical practices, leading to a more equitable and sustainable technology sector.",N/A,N/A,N/A,N/A,N/A,N/A
https://thecircuit.cc,website,"The Circuit, a data-driven collaboration, investigates Cook County’s court system, revealing systemic issues and disparities. Reports highlight racial inequities, such as Black Chicagoans disproportionately pleading guilty to gun charges and forming a larger share of defendants despite declining crime rates. Lenient sentencing for ex-officer Jason Van Dyke contrasts with harsher penalties for others. Dead-end drug arrests, costing taxpayers millions, often lead to dismissed cases but harm individuals' lives. Oregon’s drug reform decriminalizes possession but struggles to connect users with treatment. The project also scrutinizes judicial behavior, including biased rulings and barriers to justice, underscoring ongoing challenges in the legal system.",screenshots/thecircuitcc_91b0385f.png,The Circuit,"AI & Data,Civic Tech,Social Justice,Innovation & Reform,Media & Comms",2020,North America,Not specified,regional,high,complex,"Systemic inequities within Cook County's court system result in racial disparities, ineffective drug policies, and potential judicial bias, leading to unjust outcomes and financial burdens on taxpayers.","Black Chicagoans, individuals affected by drug arrests, defendants in Cook County, taxpayers","Systemic Injustice, Policy Failure","Criminal Justice, Drug Policy, Racial Justice",system change,long-term,substantial,Data analysis of court records;Investigative reporting;Public education campaigns;Collaboration with stakeholders;Advocacy for policy reform,Published reports on court system inequities;Data visualizations;News articles;Community forums;Policy recommendations,Increased public awareness of systemic issues;Changes in prosecutorial practices;Reforms in sentencing guidelines;Reduced racial disparities in the court system;Increased accountability of judicial actors,"A fair and equitable criminal justice system in Cook County that addresses racial disparities, promotes effective drug policies, and ensures accountability and justice for all.",N/A,N/A,N/A,N/A,N/A,N/A
https://thegovernmentsays.com,website,"The content discusses how the UK government has made it impossible to conceal negative news. It references a feature titled ""The Government Says,"" which monitors press releases and emails for updates, ensuring transparency by preventing the suppression of unfavorable information. The service sends daily alerts to subscribers, keeping them informed about government communications. The mention of ""Crown 2013"" indicates copyright ownership by the UK government. In essence, the content highlights a mechanism designed to promote openness and accountability in governmental communications, ensuring that bad news cannot be easily hidden from the public.",screenshots/thegovernmentsayscom_99de82d1.png,The Government Says,"Civic Tech,Gov Services,Innovation & Reform,Media & Comms,Open Systems",2013,Europe,UK Government,national,medium,complex,"The potential for government entities to suppress or conceal unfavorable information from the public, thereby hindering transparency and accountability.","Citizens of the UK, journalists, researchers, and organizations that rely on accurate and timely information from the government.",Lack of Transparency and Accountability,Government Transparency and Open Data,system change,medium-term,substantial,Monitoring government press releases and emails;Automated alerts to subscribers;Archiving government communications;Disseminating information to the public and media,Daily alerts of government communications;Publicly accessible archive of government press releases and emails;Increased awareness of government activities,Improved government transparency;Enhanced public awareness of government actions;Increased government accountability;Reduced ability of the government to hide negative news,A more open and accountable government that is responsive to the needs of its citizens and the public interest.,N/A,N/A,N/A,N/A,N/A,N/A
https://theodi.org/insights/reports/registers-and-collaboration-making-lists-we-can-trust-report,website,"The Open Data Institute (ODI) report, ""Registers and Collaboration: Making Lists We Can Trust,"" published in May 2018, explores the creation, publication, and maintenance of trusted registers or lists. Authored by David Miller and Sym Roe, the report emphasizes the importance of transparency and collaboration in managing these registers. It reviews stewardship models and presents case studies to illustrate best practices. The ODI, a non-profit organization, advocates for trust in data through training, consultancy, and tools. The report aims to enhance confidence in data stewardship and usage. For feedback or inquiries, contact Leigh Dodds at the provided email.",screenshots/theodiorg_e5f6e82e.png,Registers and Collaboration: Making Lists We Can Trust,"AI & Data,Civic Tech,Gov Services,Innovation & Reform,Open Systems",2018,Global,Unknown,global,medium,complex,"Lack of trust, transparency, and collaboration in the creation and maintenance of public registers and lists hinders effective governance and decision-making.","Governments, organizations, and individuals who rely on or contribute to public registers and lists.",Data Governance,"Open Data, Public Administration, Information Management",capacity building,medium-term,substantial,Research and analysis of existing register stewardship models.;Development and publication of best practice guidelines.;Case study analysis and dissemination.;Advocacy for open and collaborative register management.;Training and consultancy services.,Published report outlining principles and practices for trusted registers.;Case studies illustrating successful register management.;Recommendations for improving data stewardship.;Workshops and training materials.,Increased awareness of the importance of transparency and collaboration in register management.;Improved understanding of different register stewardship models.;Enhanced capacity among organizations to create and maintain trusted registers.;Greater confidence in the quality and reliability of public data.,"Improved governance, more informed decision-making, and increased trust in public data through the widespread adoption of transparent and collaborative register management practices.",N/A,N/A,N/A,N/A,N/A,N/A
https://timecounts.org,website,"Timecounts is a modern volunteer management platform designed to simplify recruiting, onboarding, scheduling, and tracking volunteers for nonprofits, schools, events, and community groups. Its features include a customizable Volunteer Hub, streamlined recruitment and onboarding processes, an organized volunteer database, efficient scheduling tools, time tracking, reporting, and centralized communication. Timecounts eliminates the need for multiple tools by integrating all functions into one platform, saving time and improving efficiency. Trusted by organizations in over 39 countries, it offers intuitive design, automation, and personalization to enhance volunteer engagement. Users can start for free and enjoy tools that make volunteer management seamless and effective.",screenshots/timecountsorg_95798a3a.png,Timecounts,"Civic Tech,Community Impact",Unknown,Global,Unknown,global,medium,complicated,"Many nonprofits, schools, events, and community groups struggle with inefficient volunteer management processes, using multiple tools for recruiting, onboarding, scheduling, and tracking volunteers. This fragmentation leads to wasted time, reduced volunteer engagement, and difficulty in accurately reporting volunteer impact.","Nonprofits, schools, event organizers, community groups, and volunteers","Operational inefficiency, volunteer management challenges","Volunteerism, nonprofit management",capacity building,medium-term,substantial,Providing a customizable Volunteer Hub;Streamlining recruitment and onboarding processes;Developing an organized volunteer database;Creating efficient scheduling tools;Implementing time tracking features;Generating reports on volunteer activity;Centralizing communication with volunteers,A unified platform for volunteer management;Increased volunteer recruitment and retention rates;Improved volunteer scheduling efficiency;Accurate volunteer hour tracking;Comprehensive reports on volunteer contributions;Enhanced communication between organizations and volunteers,Reduced administrative burden for volunteer managers;Increased volunteer engagement and satisfaction;Improved program effectiveness through better volunteer coordination;Enhanced organizational capacity to address community needs;Better data-driven decision-making regarding volunteer programs,"Empowered organizations efficiently managing volunteers, leading to enhanced community impact and a more engaged civic society.",N/A,N/A,N/A,N/A,N/A,N/A
https://tiscreport.org,website,"TISCreport.org is a platform focused on corporate transparency and ESG (Environmental, Social, and Governance) reporting. The website provides tools and resources for tracking business practices, particularly in relation to sustainability and ethical standards. Users can search and filter information by jurisdiction, covering countries and regions worldwide, including sub-national areas like provinces and states. The platform aims to enhance accountability by making corporate data accessible, enabling stakeholders to assess companies' ESG performance. Features include detailed reporting, jurisdiction-specific insights, and news updates, supporting informed decision-making for investors, regulators, and the public seeking transparency in corporate operations globally.",screenshots/tiscreportorg_b402f37f.png,TISCreport.org,"Civic Tech,AI & Data,Innovation & Reform,Open Systems,Community Impact",Unknown,Global,Unknown,global,high,complex,"Lack of corporate transparency and accountability regarding ESG (Environmental, Social, and Governance) practices hinders informed decision-making for investors, regulators, and the public, leading to potential environmental damage, social injustice, and economic instability.","Investors, regulators, consumers, civil society organizations, and other stakeholders interested in corporate ESG performance and ethical business practices.",Information asymmetry and lack of accessible data on corporate ESG performance.,"Corporate governance, environmental regulation, social responsibility, investment policy",advocacy,medium-term,substantial,Collecting and aggregating corporate ESG data from various sources.;Developing and maintaining a searchable database of corporate ESG reports and information.;Providing tools for users to analyze and compare corporate ESG performance.;Disseminating information and insights through news updates and reports.;Advocating for greater corporate transparency and accountability.,A comprehensive and searchable database of corporate ESG data.;Tools for analyzing and comparing corporate ESG performance.;Regular news updates and reports on corporate ESG issues.;Increased awareness of corporate ESG practices among stakeholders.,"Increased transparency in corporate ESG reporting.;Improved access to information on corporate ESG performance for investors, regulators, and the public.;Enhanced accountability of corporations for their ESG impact.;More informed decision-making by stakeholders regarding corporate investments and business practices.","A global economy where corporations are held accountable for their environmental and social impact, leading to more sustainable and equitable outcomes.",N/A,N/A,N/A,N/A,N/A,N/A
https://trends.whotargets.me,website,A server error has occurred FUNCTION_INVOCATION_FAILED lhr1::gsd4c-1739014798838-71334f5bb920,screenshots/trendswhotargetsme_a40688fa.png,Unavailable,Civic Tech,2024,Global,Unknown,global,critical,chaotic,"Due to an unspecified server error rendering the project unavailable, the original problem statement and other project details cannot be ascertained. Function invocation failure severely impacts access.",Unknown - information unavailable due to function error.,Technical Failure,N/A,system change,long-term,transformative,Unknown - Details unavailable due to error,N/A - No outputs available due to failure,N/A - No outcomes can be specified due to function errors.,Long-term vision cannot be determined due to the server error.,N/A,N/A,N/A,N/A,N/A,N/A
https://troubling-ai.glitch.me,website,"The ""call for screenshots"" initiative explores how AI interactions can be troubling through the lens of screenshots, a common method of capturing digital moments. Participants are invited to share screenshots of AI interactions they find concerning, along with brief explanations. These images highlight moments where situational or emergent AI behaviors override expected patterns, revealing biases, injustices, or other issues. Screenshots also carry social and political significance, as they are often shared to expose AI’s flaws, from racist search results to biased chatbots. The project aims to collectively document AI’s “weirdness” and foster discussions about its societal impact, culminating in an online publication and workshop.",screenshots/troubling-aiglitchme_3a4b607f.png,Call for Screenshots: Documenting AI Weirdness,"AI & Data,Digital Rights,Social Justice,Media & Comms,Civic Tech",2024,Global,Unknown,global,medium,complex,"AI systems often exhibit problematic behaviors like biases, injustices, and unexpected emergent properties that are difficult to track and understand at scale. The lack of comprehensive documentation and public awareness hinders efforts to address these issues effectively. Screenshots, as captured records of these interactions, can serve as critical evidence to facilitate understanding of failure modes.","Individuals interacting with AI systems, particularly those from marginalized or vulnerable groups who are disproportionately affected by AI biases and errors.","Bias and discrimination in AI systems, lack of transparency and accountability in AI development, societal impact of AI.","AI ethics, data governance, digital rights, fairness and accountability in algorithms.",advocacy,medium-term,substantial,Collecting screenshots of problematic AI interactions from participants.;Curating and analyzing submitted screenshots.;Hosting workshops and discussions to analyze documented issues.;Creating an online publication to showcase and disseminate findings.;Raising public awareness about the societal impact of AI through media and outreach.,A publicly available collection of AI interaction screenshots.;Analysis and documentation of observed issues and patterns.;An online publication featuring key findings.;Increased public awareness of the potential pitfalls of AI systems.,Increased understanding of AI biases and emergent behaviors by researchers and policymakers.;Improved public discourse on the ethical and societal implications of AI.;Greater awareness of the need for responsible AI development and deployment.;Policy changes and regulatory frameworks that promote fairness and accountability in AI systems.,"A future where AI systems are developed and deployed in a responsible and ethical manner, minimizing bias and promoting equitable outcomes for all members of society.",N/A,N/A,N/A,N/A,N/A,N/A
https://turbophonebank.com,website,"Turbo Phonebank is a free, user-friendly platform that transforms Google Sheets into phonebanks or textbanks. It features 2-tap calling, integrated text messaging, and multilingual support, making it easy for volunteers to engage contacts. Callers can use their phones or Google Voice, and customizable buttons and scripts ensure clarity. Results are automatically logged in Google Sheets, and distributed organizing allows volunteers to create their own phonebanks. Created by Evan Schwartz, a software engineer and phonebanking volunteer, Turbo Phonebank prioritizes efficiency, customization, and data security. It’s fully customizable, supports multilingual scripts, and integrates seamlessly with Google services.",screenshots/turbophonebankcom_5f786bdc.png,Turbo Phonebank,"Civic Tech,Community Impact,Social Justice,Innovation & Reform",2020,Global,Unknown,national,medium,complicated,"Many civic and political campaigns struggle with inefficient and inaccessible phonebanking and textbanking tools, hindering their outreach efforts and limiting volunteer participation. Existing solutions are often expensive, complex, and lack customization options, leaving smaller organizations and grassroots movements at a disadvantage.","Civic and political campaigns, advocacy groups, grassroots organizations, volunteers, and individuals seeking to engage in political outreach.",Inefficient communication and outreach infrastructure,"Civic engagement, electoral reform, community organizing",capacity building,medium-term,substantial,Developing and maintaining a user-friendly phonebanking and textbanking platform;Providing free access to the platform for civic and political campaigns;Offering customizable scripts and buttons for efficient communication;Integrating with Google Sheets for automatic data logging and organization;Supporting multilingual outreach efforts;Enabling distributed organizing for increased volunteer participation,Functional phonebanking and textbanking platform;Increased participation in phonebanking and textbanking campaigns;Improved data collection and organization for outreach efforts;Expanded reach to diverse communities through multilingual support,Enhanced outreach effectiveness for civic and political campaigns;Increased volunteer engagement and participation in advocacy efforts;Improved communication with constituents and stakeholders;Greater citizen participation in the democratic process,"A more engaged and informed citizenry, empowered to participate effectively in civic and political discourse and to influence policy outcomes.",N/A,N/A,N/A,N/A,N/A,N/A
https://turkopticon.ucsd.edu,website,"Turkopticon is a worker-led non-profit organization dedicated to improving conditions for Amazon Mechanical Turk (AMT) workers, known as Turkers. Originally founded by Lilly Irani and Six Silberman as a review platform, it allows workers to share information about requesters and tasks, helping to avoid unfair practices like mass rejections. Over time, Turkopticon has evolved into an advocacy group addressing broader issues such as account suspensions and requester billing problems. It operates as a userscript integrated with tools like Tampermonkey, enhancing AMT by displaying requester reviews directly on the platform. Turkopticon also conducts surveys, forums, and petitions to advocate for systemic changes and worker rights, encouraging community collaboration.",screenshots/turkopticonucsdedu_2d5029ce.png,Turkopticon,"Civic Tech,Community Impact,Social Justice,Digital Rights",2008,Global,Donations,global,medium,complex,"Amazon Mechanical Turk (AMT) workers face unfair labor practices, including low pay, arbitrary task rejections, lack of transparency, and limited recourse against exploitative requesters. This creates a power imbalance and precarious working conditions for Turkers.",Amazon Mechanical Turk (AMT) workers (Turkers),Labor exploitation and information asymmetry,Labor rights and online work regulation,advocacy,long-term,substantial,Review platform for requesters;Userscript integration for AMT interface;Surveys and data collection on working conditions;Community forum and discussion;Petitioning and advocacy for policy changes,Requester review data;Userscript providing review information within AMT;Reports on AMT working conditions;Community support networks;Policy recommendations,Increased transparency in AMT tasks;Reduced instances of unfair task rejections;Empowered workers with better information;Improved working conditions and pay for Turkers;Greater awareness of issues in online labor markets,"A more equitable and sustainable online labor ecosystem where workers are protected, fairly compensated, and have the resources they need to advocate for their rights.",N/A,N/A,N/A,N/A,N/A,N/A
