website,source_type,content_summary,screenshot_path,project_name,categories,year_founded,project_location,funding_source,problem_scope,problem_urgency,problem_complexity,problem_statement,target_population,problem_type,policy_area,primary_mechanism,timeframe,impact_potential,activities,outputs,outcomes,impact,stars,forks,last_update,created_at,open_issues,language
https://localinsight.org,website,"Local Insight is a user-friendly platform designed to help organizations make informed decisions by providing comprehensive small-area data. It offers over 1,500 indicators, customizable analysis, and easy-to-use visualizations for mapping, comparing, and reporting on communities. The platform ensures regular data updates and supports evidence-based decision-making through shareable reports. Suitable for councils, grantmakers, and charities, Local Insight features tailored outputs, personalized support, and intuitive navigation, making it accessible even for non-data experts. Recent updates include new indicators like childcare accessibility in England and mid-year population estimates. Book a demo to explore how Local Insight can benefit your community.",screenshots/localinsightorg_7106f00e.png,Local Insight,"AI & Data,Civic Tech,Gov Services,Community Impact",Unknown,Europe,Unknown,local,medium,complex,"Organizations lack access to comprehensive, easily digestible small-area data, hindering their ability to make informed decisions and effectively address local needs.","Councils, grantmakers, charities, and other organizations involved in community development and local governance.",Information Asymmetry,"Local Government, Community Development, Social Policy",capacity building,medium-term,substantial,Data aggregation and analysis;Platform development and maintenance;User training and support;Report generation and visualization;Data updates and indicator expansion,"User-friendly platform with 1500+ indicators;Customizable analysis tools;Easy-to-use visualizations (maps, comparisons, reports);Regular data updates;Shareable reports",Increased access to small-area data for organizations;Improved data literacy among users;More informed decision-making by organizations;Enhanced evidence-based practices;Better targeting of resources and interventions,"Communities benefit from data-driven decision-making, leading to improved resource allocation, more effective interventions, and ultimately, enhanced quality of life for residents.",N/A,N/A,N/A,N/A,N/A,N/A
https://manifold.markets,website,"ManifoldMANIFOLDBrowseAboutAppSign upGet1,000and3.00DiscordDarkLight (auto)Sign inMANIFOLD🗳️ Politics💻 Tech🏟️ Sports🎬 Entertainment💵 Business🤪 FunBestHotNewOpen optionsOpen© Manifold Markets, Inc.•Terms + Mana-only Terms•Privacy•RulesBrowseExploreAboutSign in",screenshots/manifoldmarkets_df0cfb35.png,Manifold Markets,"Civic Tech,Open Systems,Innovation & Reform",2020,Global,Venture Capital,global,medium,complex,"Current systems for forecasting and decision-making are often inaccurate, inefficient, and lack broad participation. Existing prediction markets are complex and inaccessible to the average person.","Individuals, organizations, and governments seeking to improve their forecasting and decision-making processes.",Information Asymmetry and Inefficient Resource Allocation,Information Technology and Public Policy,system change,medium-term,substantial,"Develop and maintain a user-friendly prediction market platform.;Incentivize participation through mana rewards and a fun, engaging interface.;Promote the platform to a wide audience, including individuals, organizations, and governments.;Foster a community of forecasters and decision-makers who can share insights and learn from each other.",A functional prediction market platform.;A growing user base of forecasters and decision-makers.;Real-time forecasts on a variety of topics.;API Access for third-party applications.,Improved accuracy of forecasts.;More efficient allocation of resources.;Better-informed decision-making.;Increased public engagement in forecasting and decision-making processes.,"To create a world where forecasting and decision-making are more accurate, efficient, and democratic, leading to improved outcomes for individuals, organizations, and society as a whole.",N/A,N/A,N/A,N/A,N/A,N/A
https://mapit.mysociety.org,website,"MapIt : map postcodes and geographical points to administrative areas mySociety MapIt Home Pricing Documentation Log in Sign up The easy way to match points to boundaries If your app or website needs to connect UK locations with areas like constituencies or counties, MapIt can save you a lot of time. MapIt is mature, trusted and widely deployed — and it is designed to fit right into your website or app, quickly and simply. Try it out – enter a postcode What is MapIt? It matches geographic points with areas Input a postcode, and MapIt knows which constituency, parish, council area it’s in – and lots more. It’s an API you can call from websites and apps MapIt’s stable, well documented API makes it easy to integrate into a range of software solutions. And all with a clear, hassle-free subscription Signing up is quick and easy, with automatic monthly payments and no lengthy tie-ins. See our pricing plans. Your user inputs any of these… A UK postcode Their position via GPS A pin on a map An",screenshots/mapitmysocietyorg_4ca207b3.png,MapIt,"Civic Tech,Gov Services,Open Systems,Infrastructure",2007,Europe,Subscription revenue,national,medium,complicated,"Many applications and websites require the ability to link geographical points (e.g., postcodes, GPS coordinates) to administrative areas (e.g., constituencies, counties). Manually creating and maintaining this mapping is time-consuming, complex, and prone to error.","Developers, organizations, and individuals who need to connect UK locations with administrative boundaries.",Information access and data management,Government transparency and data infrastructure,direct service,medium-term,substantial,Providing an API to match geographic points with administrative areas.;Maintaining and updating the database of administrative boundaries and their corresponding geographical points.;Offering a subscription service for accessing the API.,A functional API.;Up-to-date data on UK administrative boundaries.;Subscription plans for users with varying needs.;Clear and comprehensive API documentation.,Reduced development time for applications and websites that require location-based services.;Improved accuracy and reliability of location-based data.;Increased accessibility to geographic data for a wider range of users.;Efficiently integrating geographical data into apps,"Simplified access to location data, empowering developers and organizations to build better civic technology applications and services, leading to improved government transparency and citizen engagement.",N/A,N/A,N/A,N/A,N/A,N/A
https://mapped.commonknowledge.coop,website,"Mapped by Common Knowledge is a web-based tool for organisers and activists to enhance their campaigns by enriching contact data with location-specific information like constituencies, wards, and NHS Health Authority. Users upload a CSV or spreadsheet with postcodes, and Mapped adds these details without storing data on servers, ensuring privacy. The tool supports recruiting, canvassing, and fundraising efforts. It integrates with CRMs like Mailchimp and NationBuilder for seamless workflows. Future updates include CRM integration and new features. Funded by Civic Power Fund and Joseph Rowntree Reform Trust, Mapped promotes social movement-building technology. Users can subscribe for updates or support the project.",screenshots/mappedcommonknowledgecoop_7d05d4cd.png,Mapped by Common Knowledge,"Civic Tech,Social Justice,AI & Data",2020,Europe,"Civic Power Fund, Joseph Rowntree Reform Trust",national,medium,complicated,"Organisers and activists face challenges in efficiently enriching contact data with location-specific information needed for targeted campaigns. This hinders effective recruitment, canvassing and fundraising.","Organisers, activists, and campaign staff",Data Management and Campaign Efficiency,Civic Engagement,capacity building,medium-term,substantial,Developing and maintaining the Mapped web tool.;Providing postcode enrichment services.;Integrating with CRM platforms.,Web-based tool for enriching contact data.;Location-specific information added to user-uploaded data.;Integration with CRMs like Mailchimp and NationBuilder.,"Increased efficiency in recruitment, canvassing, and fundraising.;Improved targeting of campaign efforts.;Enhanced data management for organisers and activists.",Empowered and effective social movements built through accessible and privacy-respecting technology.,N/A,N/A,N/A,N/A,N/A,N/A
https://mapping.kids,website,"Kidmapping is a resource tracking the locations of deported Ukrainian children in Russia, Belarus, and occupied territories. It acknowledges past deportations under Russian rule as colonization instruments, aiming to preserve the memory of these crimes. The project uses open-source information (news, social media, etc.) to identify locations, being mindful of the influence of Russian entities like the Investigative Committee and the Orthodox Church.
Map points indicate the probability of finding children: red (high probability, often permanent relocation), yellow (less likely, temporary stays), and grey (potential locations with no confirmed data). The project maintains secrecy about its exact search terms and urges the media to be cautious with information that could endanger children's return.
Kidmapping encourages public support through information sharing, subscribing to their Instagram, and collaboration with journalists/investigators. They request information regarding errors on the website, any data that is not on their website and offer collaboration or information sharing to the press via their contact email with the proper subject line.",,Kidmapping,"Civic Tech,Social Justice,Open Systems,AI & Data,Community Impact,Media & Comms",2022,Europe,Unknown,global,critical,complex,"The forced deportation and relocation of Ukrainian children by Russia constitutes a grave human rights violation and a tool of cultural erasure. Tracking, documenting, and ultimately facilitating the reunification of these children with their families are critical to addressing this ongoing crisis and preserving evidence of these war crimes.","Ukrainian children deported to Russia, Belarus, and occupied territories, and their families.","Human Rights Violation, War Crime, Child Trafficking","International Law, Human Rights, Child Welfare, Geopolitics",advocacy,long-term,transformative,"Collecting and verifying open-source information on the location of deported Ukrainian children.;Mapping the likely locations of the children using a probability-based system (red, yellow, grey).;Maintaining secrecy around search terms to protect the safety of the children.;Encouraging public support through information sharing.;Collaborating with journalists and investigators to raise awareness and support reunification efforts.;Soliciting information from the public regarding errors or new data.",A publicly accessible map showing the probable locations of deported Ukrainian children.;A database of verified information on the children and their locations.;Reports and publications documenting the deportations and their impact.;Media coverage of the issue.;Public awareness campaigns.;Requests for information from the public to aid in project completion,Increased awareness of the forced deportation of Ukrainian children.;Identification of locations where deported children are likely to be found.;Increased public pressure on Russia and Belarus to return the children.;Facilitation of family reunification efforts.;Gathering and preservation of evidence;Increased public information regarding the problem,"The long-term vision is to end the forced deportation of Ukrainian children, hold perpetrators accountable for their actions, and ensure that all deported children are safely returned to their families and communities. Prevent future acts of cultural erasure and address the ongoing trauma inflicted on Ukrainian families.",N/A,N/A,N/A,N/A,N/A,N/A
https://matrix.org,website,"Matrix is an open, decentralized network designed for secure communication. It supports chat with friends, family, and communities, offering a safe and supercharged environment for interactions. Matrix allows users to build advanced, rich communication applications through its ecosystem of clients, servers, bots, and application services. Fully open-source, it provides extensive developer documentation and specifications for those looking to create apps on its platform. Matrix emphasizes security and collaboration, with resources like a security disclosure policy and a hall of fame. Users can support the project through donations or by shopping, while maintaining transparency with a code of conduct and legal policies.",screenshots/matrixorg_887c7b43.png,Matrix,"Civic Tech,Digital Rights,Infrastructure,Open Systems,Media & Comms",2014,Global,Donations and Shopping,global,medium,complex,"Lack of an open, decentralized, and secure communication platform that ensures user privacy and control, and allows interoperability between different communication systems, resulting in fragmented communication and potential security vulnerabilities.","Individuals, communities, and organizations seeking secure and private communication channels, and developers aiming to build communication applications.",Communication infrastructure and digital rights,"Internet governance, digital privacy, and cybersecurity",system change,long-term,transformative,Developing and maintaining the Matrix protocol specification.;Creating and supporting open-source client and server implementations.;Providing developer documentation and resources.;Promoting the adoption of Matrix through community engagement and marketing.;Ensuring security through ongoing audits and a responsible disclosure policy.,"The Matrix protocol specification.;Open-source client and server software (e.g., Element, Synapse).;Developer documentation and APIs.;A thriving Matrix ecosystem of clients, servers, bots, and application services.",Increased adoption of Matrix as a secure communication platform.;Improved interoperability between different communication systems.;Greater user control over their communication data.;Enhanced privacy and security for online interactions.;Development of innovative communication applications on the Matrix platform.,"A future where communication is open, secure, and decentralized, empowering users to control their digital identities and interactions, fostering a more trustworthy and participatory digital society.",N/A,N/A,N/A,N/A,N/A,N/A
https://medium.com/@abscond/membership-a-prototype-ea822b2683b,website,"James Darling explores the need to transform civic institutions for the 21st century, focusing on membership-driven organizations like the Labour Party. He built a prototype in October 2016, addressing challenges such as data management, volunteer engagement, and the dichotomy between centralized organizations and grassroots movements. Traditional models often bureaucratize volunteers, while grassroots efforts struggle with scalability. Darling’s prototype, termed an ""MRM"" (Membership Relationship Manager), aims to bridge this gap by using open-source code to create flexible systems for member-based organizations. It focuses on managing personal data effectively while fostering collaboration between grassroots teams and central headquarters, offering a foundational tool for modern civic engagement.",,Membership Relationship Manager (MRM) Prototype,"Civic Tech,Open Systems,Innovation & Reform",2016,Global,Unknown,national,medium,complex,"Civic institutions, particularly membership-driven organizations, face challenges in effectively managing data, engaging volunteers, and bridging the gap between centralized structures and grassroots movements. Traditional models often lead to volunteer bureaucratization, while grassroots efforts struggle to scale and integrate effectively with central operations.","Membership-driven organizations, volunteers, members of political parties, and civic institutions.",Organizational inefficiency and lack of effective tools for member engagement and data management.,"Civic engagement, data governance, organizational management.",capacity building,medium-term,substantial,Developing an open-source MRM prototype.;Designing flexible systems for member-based organizations.;Facilitating collaboration between grassroots teams and central headquarters.;Managing personal data effectively.,An open-source MRM prototype.;A system for managing member data.;Tools to enhance volunteer engagement.;A platform for collaboration.,Improved data management within civic organizations.;Increased volunteer engagement and retention.;Enhanced collaboration between grassroots teams and central headquarters.;Greater organizational efficiency and effectiveness.,"Transformed civic institutions capable of effectively engaging members, managing data, and fostering collaboration, leading to a more participatory and responsive civic landscape.",N/A,N/A,N/A,N/A,N/A,N/A
https://medium.com/metagov/introducing-the-agreement-engine-bf03b6d5c16c,website,"The article introduces the *Agreement Engine*, an open-source software service designed to create modular systems for agreements, blending social, legal, and computational elements. Agreements, essential for collaboration in various contexts (business, gaming, etc.), hinge on mutual assent and often incur obligations. The piece explores how traditional legal contracts, smart contracts, and informal agreements differ in user experience and enforcement. It highlights the evolution of contract systems toward computational and legal integration, emphasizing the need for user-friendly, enforceable agreements in digital spaces. The *Agreement Engine* aims to transform web resources into enforceable contracts, part of the broader Metagov toolkit for online governance.",,Agreement Engine,"Civic Tech,Open Systems,Gov Services,Innovation & Reform",2020,Global,Metagov,global,medium,complex,"The lack of user-friendly, enforceable agreement systems in digital spaces hinders collaboration and creates uncertainty in online interactions. Existing solutions like traditional legal contracts, smart contracts, and informal agreements each have limitations in user experience, enforcement, and accessibility.","Businesses, online communities, gamers, and anyone engaging in collaborations requiring enforceable agreements online.",Governance and legal infrastructure for online environments.,"Internet governance, digital law, contract law",system change,medium-term,substantial,Developing the open-source Agreement Engine software.;Integrating legal and computational elements into a modular agreement system.;Testing and refining the Agreement Engine with pilot communities.;Promoting the adoption of the Agreement Engine within the Metagov toolkit.;Building resources and documentation for developers and users.,Open-source Agreement Engine software.;Modular agreement templates.;API and integration tools.;Documentation and tutorials.;Pilot implementations in online communities.,Increased adoption of enforceable agreements in digital spaces.;Improved user experience in creating and managing agreements.;Reduced uncertainty and disputes in online collaborations.;Greater trust and transparency in online governance.;Streamlined integration of legal and computational aspects of agreements.,"To transform web resources into enforceable contracts, fostering trust, transparency, and effective governance in online environments.",N/A,N/A,N/A,N/A,N/A,N/A
https://membershippuzzle.org,website,"The Membership Puzzle Project About Project Media People Summit Membership Guide Research Tools Fund Menu Street Address City, State, Zip Phone Number Your Custom Text Here About Project Media People Summit Membership Guide Research Tools Fund The Membership GuideAre you a newsroom seeking practical advice on your membership strategy? Check out the Membership Guide, which includes step-by-step processes for important decisions and more than three dozen case studies.Would you prefer getting that information via a newsletter course? We designed one with the Lenfest Institute for Journalism. You can sign up to start at any time. the guide the course If you are… Looking for a clear explanation of what membership is and how it differs from donations and subscriptions, we’ve got that ›Trying to catch up on our summit, here are the recordings ›A media coach or consultant looking for inspiration, steal our coaching resources ›Looking for an overview on how membership fits within the broader la",,Membership Puzzle Project,"Media & Comms,Civic Tech",Unknown,Global,Unknown,global,medium,complex,"Newsrooms struggle to develop sustainable membership strategies, hindering their ability to provide quality journalism and connect with their audiences effectively. This leads to a weakened media ecosystem and reduced public access to reliable information.","Newsrooms, journalists, media professionals, and the public who rely on quality journalism.",Sustainability of journalism,"Media policy, funding for journalism",capacity building,medium-term,substantial,Creating and distributing the Membership Guide;Offering a newsletter course in collaboration with the Lenfest Institute;Organizing summits and providing recordings;Developing and sharing coaching resources for media professionals,The Membership Guide (a practical resource);A newsletter course on membership strategies;Summit recordings and materials;Coaching resources for media consultants,Increased knowledge and understanding of membership strategies among newsrooms;Improved implementation of effective membership programs;Enhanced engagement between newsrooms and their audiences;Greater financial stability for participating news organizations,"A more sustainable and vibrant media ecosystem with stronger connections between newsrooms and communities, ensuring public access to reliable information and fostering a more informed and engaged citizenry.",N/A,N/A,N/A,N/A,N/A,N/A
https://membersinterests.org.uk,website,"Please adjust your browser settings or upgrade your browser to run this app.

The webpage indicates that JavaScript is required to access its content, specifically titled ""Members Interests."" Users are instructed to either enable JavaScript in their browser settings or upgrade their browser if it doesn't support JavaScript. This suggests that the site uses JavaScript to display or interact with the information related to members' interests, and without it, the content won't be accessible. Ensuring JavaScript is enabled or using a compatible browser is essential to view and interact with the page's functionality. 

The webpage titled ""Members Interests"" requires JavaScript to function properly. Users are instructed to enable JavaScript in their browser settings or upgrade their browser if it doesn’t support JavaScript. This indicates that the site relies on JavaScript to display or interact with content related to members' interests. Without JavaScript enabled, the page's functionality and content will not be accessible. Ensuring JavaScript is active or using a compatible browser is essential to fully utilize the webpage.",,Members Interests Webpage,"Civic Tech,Gov Services,Open Systems",2024,Global,Unknown,global,low,simple,"Users are unable to access the 'Members Interests' webpage content due to the requirement of JavaScript being enabled in their browser. Without JavaScript, the functionality and data on the page are inaccessible.",Users attempting to access the 'Members Interests' webpage.,Accessibility/Usability,Web Accessibility,direct service,short-term,incremental,Instructing Users about Javascript requirements;Ensuring webpage can explain Javascript requirements,Webpage displaying alternative content that informs users of the JavaScript pre-requisite,Improved accessibility for users with JavaScript disabled;Increased awareness of JavaScript dependency for web content,Enabling all users to access crucial information regardless of their browser configuration.,N/A,N/A,N/A,N/A,N/A,N/A
